{
  "doc_id": "synth-010",
  "pdf": "pdfs/synth-010.pdf",
  "source": "synthetic",
  "page_count": 13,
  "generator_note": "Synthetically generated clean-text PDF. Does not represent the scanned pages, malformed tables or OCR noise present in real tender documents.",
  "fields": {
    "tender_title": "Design and Development of Integrated Command and Control Centre",
    "submission_deadline": "24 January 2027 11:00 IST",
    "minimum_turnover": {
      "value": 120000000,
      "currency": "INR",
      "raw": "Rs. 1200 lakhs"
    },
    "earnest_money_deposit_emd": {
      "value": 2500000,
      "currency": "INR",
      "raw": "Rs. 25,00,000"
    },
    "document_fee": {
      "value": 2000,
      "currency": "INR",
      "raw": "Rs. 2,000"
    },
    "solvency_certificate_required": true,
    "experience_years": 10,
    "contract_duration_months": 24,
    "bid_validity_days": 90,
    "warranty_years": 2,
    "liquidated_damages_rate": "0.5%",
    "liquidated_damages_cap": "5%",
    "performance_guarantee_pct": "5%",
    "liability_cap": "100%",
    "joint_ventures_allowed": true,
    "subcontracting_limit": "25%",
    "arbitration_seat": "Hyderabad",
    "bid_language": "English or Hindi"
  },
  "questions": [
    {
      "id": 1,
      "query": "What is the proposal submission deadline?",
      "gold_span": "The last date and time for submission of bids is 24 January 2027 at 11:00 hours IST.",
      "gold_page": 1,
      "field": "submission_deadline"
    },
    {
      "id": 2,
      "query": "When is the pre-bid meeting scheduled?",
      "gold_span": "A pre-bid meeting shall be convened on 28 December 2027 at the office of the State Urban Development Authority.",
      "gold_page": 1,
      "field": "prebid_date"
    },
    {
      "id": 3,
      "query": "What is the tender document fee?",
      "gold_span": "A non-refundable tender document fee of Rs. 2,000 shall be paid online at the time of bid submission.",
      "gold_page": 1,
      "field": "document_fee"
    },
    {
      "id": 4,
      "query": "What is the minimum annual turnover requirement?",
      "gold_span": "Minimum Average Annual Turnover Rs. 1200 lakhs",
      "gold_page": 3,
      "field": "minimum_turnover"
    },
    {
      "id": 5,
      "query": "What is the Earnest Money Deposit amount?",
      "gold_span": "Earnest Money Deposit (EMD) Rs. 25,00,000",
      "gold_page": 3,
      "field": "emd"
    },
    {
      "id": 6,
      "query": "Is a bank solvency certificate required?",
      "gold_span": "A bank solvency certificate issued by a scheduled commercial bank within the preceding six months is mandatory and shall be enclosed with the technical bid.",
      "gold_page": 3,
      "field": "solvency_certificate"
    },
    {
      "id": 7,
      "query": "What is the bid validity period?",
      "gold_span": "Bids shall remain valid for a period of 90 days from the date of opening of the technical bid.",
      "gold_page": 3,
      "field": "bid_validity"
    },
    {
      "id": 8,
      "query": "What is the payment milestone schedule?",
      "gold_span": "Payments shall be released against milestones as follows: 10% as mobilisation advance against an equivalent bank guarantee, 50% on delivery and installation, and the balance 40% on final acceptance testing and handover.",
      "gold_page": 5,
      "field": "payment_schedule"
    },
    {
      "id": 9,
      "query": "What is the contract execution duration?",
      "gold_span": "The contract shall be executed over a period of 24 months from the date of issue of the letter of award.",
      "gold_page": 5,
      "field": "contract_duration"
    },
    {
      "id": 10,
      "query": "What is the dispute resolution mechanism?",
      "gold_span": "Any dispute arising out of or in connection with this contract shall be referred to arbitration under the Arbitration and Conciliation Act, 1996, with Hyderabad as the seat of arbitration.",
      "gold_page": 7,
      "field": "dispute_resolution"
    },
    {
      "id": 11,
      "query": "In what language must bid documents be submitted?",
      "gold_span": "All bid documents, correspondence and deliverables shall be submitted in English or Hindi.",
      "gold_page": 7,
      "field": "bid_language"
    },
    {
      "id": 12,
      "query": "What is the minimum years of experience required?",
      "gold_span": "The bidder shall have a minimum of 10 years of experience in executing projects of a similar nature in the field of Smart Cities.",
      "gold_page": 9,
      "field": "experience_years"
    },
    {
      "id": 13,
      "query": "Which ISO certifications are required?",
      "gold_span": "The bidder shall hold valid ISO 9001:2015 and ISO 14001:2015 certifications as on the date of bid submission.",
      "gold_page": 9,
      "field": "iso_certifications"
    },
    {
      "id": 14,
      "query": "Are joint ventures or consortiums allowed?",
      "gold_span": "Joint ventures and consortium bids are permitted, subject to a maximum of two members and submission of a registered joint venture agreement.",
      "gold_page": 9,
      "field": "joint_ventures"
    },
    {
      "id": 15,
      "query": "Is sub-contracting allowed and to what extent?",
      "gold_span": "Sub-contracting of the awarded work is permitted only up to 25% of the total contract value, and only with the prior written approval of the Purchaser.",
      "gold_page": 9,
      "field": "subcontracting"
    },
    {
      "id": 16,
      "query": "What is the liquidated damages rate for delay?",
      "gold_span": "In the event of delay in completion, liquidated damages shall be levied at 0.5% of the contract value per fortnight of delay, subject to an overall ceiling of 5% of the total contract value.",
      "gold_page": 11,
      "field": "liquidated_damages"
    },
    {
      "id": 17,
      "query": "What is the performance bank guarantee requirement?",
      "gold_span": "The successful bidder shall furnish a performance bank guarantee equal to 5% of the contract value, valid for 30 months from the date of award.",
      "gold_page": 11,
      "field": "performance_guarantee"
    },
    {
      "id": 18,
      "query": "What is the warranty period required?",
      "gold_span": "All supplied equipment shall carry a comprehensive on-site warranty of 2 years from the date of successful commissioning.",
      "gold_page": 11,
      "field": "warranty_period"
    },
    {
      "id": 19,
      "query": "What is the limitation of liability cap?",
      "gold_span": "The aggregate liability of the contractor under this contract shall not exceed 100% of the total contract value, save in cases of fraud, wilful misconduct or breach of confidentiality obligations.",
      "gold_page": 11,
      "field": "liability_cap"
    }
  ]
}